{
  "$schema": "./schema/feature.schema.json",
  "id": "report-triage-2026-10-005",
  "title": "Validation humaine des signalements avant tout travail de Claude",
  "status": "in-progress",
  "owner": "nrineau",
  "github": {
    "issue": "essensys-hub/essensys-feature-lifecycle#18",
    "project_item": "PVTI_lADODqt0Wc4BavHTzg_3MMA"
  },
  "git": {
    "branch": "feat/report-triage-2026-10-005",
    "pr_url": null
  },
  "openspec": {
    "change_id": "report-triage-2026-10-005",
    "path": "openspec/changes/report-triage-2026-10-005",
    "proposal": "openspec/changes/report-triage-2026-10-005/proposal.md",
    "design": "openspec/changes/report-triage-2026-10-005/design.md",
    "tasks": "openspec/changes/report-triage-2026-10-005/tasks.md",
    "specs": [
      "openspec/changes/report-triage-2026-10-005/specs/report-triage/spec.md"
    ]
  },
  "implementation": {
    "paths": [
      "scripts/feature_lifecycle/triage.py",
      "scripts/feature_lifecycle/triage_gate.py",
      "scripts/feature_lifecycle/triage_guard.py",
      "scripts/feature_lifecycle/list_workable.py",
      "scripts/feature_lifecycle/setup_triage_repo.py",
      "scripts/feature_lifecycle/project_sync.py",
      ".github/workflows/triage-guard.yml",
      "claude/hooks/block_self_validation.py",
      "claude/GOVERNANCE.md",
      "claude/commands/ticket-to-spec.md",
      "claude/commands/checkup.md",
      "scripts/install-claude.sh"
    ],
    "primary_surface": "ci"
  },
  "userguide": {
    "pages": [
      "docs/feature-lifecycle/triage.md"
    ],
    "language": "fr",
    "i18n_keys": [],
    "screenshots": []
  },
  "tests": {
    "playwright": [],
    "pytest": [
      "scripts/feature_lifecycle/tests/test_triage.py",
      "scripts/feature_lifecycle/tests/test_triage_hook.py"
    ],
    "coverage_must_test": [
      "unvalidated report is not workable",
      "bot is never maintainer",
      "advance refused on a valider",
      "valide by non maintainer is removed",
      "hook blocks gh add label valide"
    ],
    "smoke_tags": [
      "@nr",
      "@security"
    ]
  },
  "release": {
    "changelog_entry": "Validation humaine obligatoire (labels a-valider / valide) des signalements et issues de tiers avant tout travail de Claude : workflow triage-guard, gate des commandes, hook local.",
    "target_tag": null,
    "surfaces": [
      "essensys-feature-lifecycle",
      "essensys-support-site",
      "essensys-support",
      "essensys-user-portal-backend"
    ],
    "paths": [
      "claude/GOVERNANCE.md",
      ".github/workflows/triage-guard.yml",
      "scripts/feature_lifecycle/triage_gate.py"
    ]
  },
  "security": {
    "sca_tool": "dependabot",
    "dependabot_alerts_url": null,
    "last_scan_at": null,
    "cve_findings": {
      "critical": 0,
      "high": 0,
      "medium": 0,
      "low": 0
    },
    "secret_scan": {
      "status": "clean",
      "tool": "gitleaks",
      "last_scan_at": null
    },
    "muted_findings": [],
    "threat_model_url": "openspec/changes/report-triage-2026-10-005/design.md",
    "owner_security": "nrineau"
  }
}
